{
  "$schema": "../schemas/model-surface-acceptance.schema.json",
  "format": "exactscope.model-surface.acceptance",
  "format_version": "0.1",
  "accepted_abi_revisions": ["1.0"],
  "accepted_hotset_format_versions": ["0.1"],
  "accepted_asset_contracts": {
    "exactscope.prompt-fragment": ["0.1"],
    "exactscope.xs-calc.gbnf": ["0.1"],
    "exactscope.xs-calc.tool": ["0.1"],
    "exactscope.xs-eval.gbnf": ["0.1"],
    "exactscope.xs-eval.tool": ["0.1"]
  },
  "require_exact_asset_digests": true
}
